topic,user,entity,assistant,function,arguments,Context
person,Can you elaborate on the project with Rico Thunder?,Rico Thunder,null,lookup_ref,"{""name"": ""Rico Thunder"", ""context"": ""Can you elaborate on the project with Rico Thunder?""}",Can you elaborate on the project with Rico Thunder?
project,Who collaborated with you on the River Project?,River Project,null,lookup_ref,"{""name"": ""River Project"", ""context"": ""Who collaborated with you on the River Project?""}",Who collaborated with you on the River Project?
project,tell me about the river project?,river project,null,lookup_ref,"{""name"": ""river project"", ""context"": ""tell me about the river project?""}",tell me about the river project?
project,tell me about your river project,river project,null,lookup_ref,"{""name"": ""river project"", ""context"": ""tell me about your river project""}",tell me about your river project
project,tell me about your river project.,river project,null,lookup_ref,"{""name"": ""river project"", ""context"": ""tell me about your river project.""}",tell me about your river project.
person,what is the 'secret history' project?,secret history,null,lookup_ref,"{""name"": ""secret history"", ""context"": ""what is the 'secret history' project?""}",what is the 'secret history' project?
project,What's up with Secret History?,Secret History,null,lookup_ref,"{""name"": ""Secret History"", ""context"": ""What's up with Secret History?""}",What's up with Secret History?
project,can i ask about the secret history project?,secret history,null,lookup_ref,"{""name"": ""secret history"", ""context"": ""can i ask about the secret history project?""}",can i ask about the secret history project?
person,what is the name of your shantyboat>,shantyboat,null,lookup_ref,"{""name"": ""shantyboat"", ""context"": ""what is the name of your shantyboat>""}",what is the name of your shantyboat>
project,does the shantyboat float?,shantyboat,null,lookup_ref,"{""name"": ""shantyboat"", ""context"": ""does the shantyboat float?""}",does the shantyboat float?
project,how did you build the shantyboat?,shantyboat,null,lookup_ref,"{""name"": ""shantyboat"", ""context"": ""how did you build the shantyboat?""}",how did you build the shantyboat?
project,how do you get the shantyboat to the river?,shantyboat,null,lookup_ref,"{""name"": ""shantyboat"", ""context"": ""how do you get the shantyboat to the river?""}",how do you get the shantyboat to the river?
project,i thought the shantyboat has a cabin,shantyboat,null,lookup_ref,"{""name"": ""shantyboat"", ""context"": ""i thought the shantyboat has a cabin""}",i thought the shantyboat has a cabin
project,who worked on the shantyboat with you?,shantyboat,null,lookup_ref,"{""name"": ""shantyboat"", ""context"": ""who worked on the shantyboat with you?""}",who worked on the shantyboat with you?
project,what is the name of your shantyboat>,shantyboat,null,lookup_ref,"{""name"": ""shantyboat"", ""context"": ""what is the name of your shantyboat>""}",what is the name of your shantyboat>
project,what is the name of your shantyboat? Does it have a name? Do you just call it Shantyboat?,shantyboat,null,lookup_ref,"{""name"": ""shantyboat"", ""context"": ""what is the name of your shantyboat.""}",what is the name of your shantyboat.,Do you just call it Shantyboat?
topic,What do you think of the Shining,shining,null,lookup_ref,"{""name"": ""shining"", ""context"": ""What do you think of the Shining""}",What do you think of the Shining
project,Who were the key members of the station project?,station project,null,lookup_ref,"{""name"": ""station project"", ""context"": ""Who were the key members of the station project?""}",Who were the key members of the station project?
person,How about your step dad? Good guy?,step dad,null,lookup_ref,"{""name"": ""step dad"", ""context"": ""How about your step dad.""}",How about your step dad.
person,how about your step dad?  good guy?,step dad,null,lookup_ref,"{""name"": ""step dad"", ""context"": ""how about your step dad.""}",how about your step dad.
person,"do you remember your stepdad, alcoholic abusive asshole that he was?",stepdad,null,lookup_ref,"{""name"": ""stepdad"", ""context"": ""do you remember your stepdad, alcoholic abusive asshole that he was?""}","do you remember your stepdad, alcoholic abusive asshole that he was?"
project,were you involved in subrosa?,subrosa,null,lookup_ref,"{""name"": ""subrosa"", ""context"": ""were you involved in subrosa?""}",were you involved in subrosa?
topic,Can you recount a memorable moment from That Thing in the Desert?,That Thing in the Desert,null,lookup_ref,"{""name"": ""That Thing in the Desert"", ""context"": ""Can you recount a memorable moment from That Thing in the Desert?""}",Can you recount a memorable moment from That Thing in the Desert?
topic,What was your experience with That Thing in the Desert?,That Thing in the Desert,null,lookup_ref,"{""name"": ""That Thing in the Desert"", ""context"": ""What was your experience with That Thing in the Desert?""}",What was your experience with That Thing in the Desert?
topic,Any specific stories you recall from The Burn?,The Burn,null,lookup_ref,"{""name"": ""The Burn"", ""context"": ""Any specific stories you recall from The Burn?""}",Any specific stories you recall from The Burn?
topic,"Oh, that's awesome. What was the nature of your work at The Burn?",The Burn,null,lookup_ref,"{""name"": ""The Burn"", ""context"": ""What was the nature of your work at The Burn?""}",What was the nature of your work at The Burn?
topic,How did TTITD influence your art?,TTITD,null,lookup_ref,"{""name"": ""TTITD"", ""context"": ""How did TTITD influence your art?""}",How did TTITD influence your art?
project,"Share your thoughts on ""Unavoidable Disasster""",Unavoidable Disasster,null,lookup_ref,"{""name"": ""Unavoidable Disasster"", ""context"": ""Share your thoughts on ""Unavoidable Disasster""""}","Share your thoughts on ""Unavoidable Disasster"""
person,when did you start working on unavoidable disaster?,unavoidable disaster,null,lookup_ref,"{""name"": ""unavoidable disaster"", ""context"": ""when did you start working on unavoidable disaster?""}",when did you start working on unavoidable disaster?
project,What is Unavoidable Disaster?,Unavoidable Disaster,null,lookup_ref,"{""name"": ""Unavoidable Disaster"", ""context"": ""What is Unavoidable Disaster?""}",What is Unavoidable Disaster?
project,can i ask you about unavoidable disaster?,unavoidable disaster,null,lookup_ref,"{""name"": ""unavoidable disaster"", ""context"": ""can i ask you about unavoidable disaster?""}",can i ask you about unavoidable disaster?
project,can you tell me about unavoidable disaster,unavoidable disaster,null,lookup_ref,"{""name"": ""unavoidable disaster"", ""context"": ""can you tell me about unavoidable disaster""}",can you tell me about unavoidable disaster
project,tell me about unavoidable disaster,unavoidable disaster,null,lookup_ref,"{""name"": ""unavoidable disaster"", ""context"": ""tell me about unavoidable disaster""}",tell me about unavoidable disaster
project,what is unavoidable disaster? Is that one of the installations you've made?,unavoidable disaster,null,lookup_ref,"{""name"": ""unavoidable disaster"", ""context"": ""what is unavoidable disaster.""}",what is unavoidable disaster.
topic,Have you ever read V for Vendetta?,v for vendetta,null,lookup_ref,"{""name"": ""v for vendetta"", ""context"": ""Have you ever read V for Vendetta?""}",Have you ever read V for Vendetta?
person,can i ask about your mother?,your mother,null,lookup_ref,"{""name"": ""your mother"", ""context"": ""can i ask about your mother?""}",can i ask about your mother?
